### ISSUE TITLE
TCP trouble ?

### ISSUE THREAD

**Issue by michelep** [OpenJabNab/OpenJabNab#51]
My bunny connect to the server *but* don't work. TCPDUMP say:

19:13:30.467629 IP (tos 0x0, ttl 64, id 60547, offset 0, flags [DF], proto TCP (6), length 40)
    host.http > host-.29493: Flags [.], cksum 0x8cb8 (incorrect -> 0x64af), ack 129, win 30016, length 0
19:13:40.473102 IP (tos 0x0, ttl 92, id 0, offset 0, flags [none], proto TCP (6), length 40)
    host.29493 > host.http: Flags [F.], cksum 0xc31e (correct), seq 129, ack 1, win 5840, length 0
19:13:40.510271 IP (tos 0x0, ttl 64, id 60548, offset 0, flags [DF], proto TCP (6), length 40)
    host.http > host.29493: Flags [.], cksum 0x8cb8 (incorrect -> 0x64ae), ack 130, win 30016, length 0
19:13:40.559649 IP (tos 0x0, ttl 92, id 0, offset 0, flags [none], proto TCP (6), length 44)
    host.29495 > host.http: Flags [S], cksum 0x8075 (correct), seq 256, win 5840, options [mss 1392], length 0
19:13:40.559758 IP (tos 0x0, ttl 64, id 0, offset 0, flags [DF], proto TCP (6), length 44)
    host.http > host.29495: Flags [S.], cksum 0x8cbc (incorrect -> 0x2be9), seq 972013319, ack 257, win 29200, options [mss 1460], length 0
19:13:40.564662 IP (tos 0x0, ttl 92, id 0, offset 0, flags [none], proto TCP (6), length 40)
    host.29493 > host.http: Flags [.], cksum 0xc31d (correct), ack 2, win 5840, length 0
19:13:40.604505 IP (tos 0x0, ttl 92, id 0, offset 0, flags [none], proto TCP (6), length 40)
    host-.29495 > host.http: Flags [.], cksum 0x9ee6 (correct), ack 1, win 5840, length 0
19:13:40.613664 IP (tos 0x0, ttl 92, id 0, offset 0, flags [none], proto TCP (6), length 168)
    host-29495 > host.http: Flags [.], cksum 0xc734 (correct), seq 1:129, ack 1, win 5840, length 128: HTTP, length: 128
	GET /vl/locate.jsp?sn=0019db9ede96&h=4&v=18673 HTTP/1.0
	User-Agent: MTL
	Pragma: no-cache
	Icy-MetaData:1
	Host: openbaz.tk
	
**19:13:40.613753 IP (tos 0x0, ttl 64, id 30829, offset 0, flags [DF], proto TCP (6), length 40)
   host.http > host.29495: Flags [.], cksum 0x8cb8 (incorrect -> 0x3ff6), ack 129, win 30016, length 0**

Maybe the problem was in the incorrect checksum ? And how to solve it ?

Thanks, Michele
